[
  {
    "articles": [
      {
        "number": 3,
        "sha256": "ef61b2e85b31c3522c154fd8d28fb4b9ae161c69e801bc62bdd281c288758cd0",
        "text": "第三条 平等主体的自然人、法人、非法人组织之间发生的合同纠纷和其他财产权益纠纷，可以仲裁。 下列纠纷不能仲裁： （一）婚姻、收养、监护、扶养、继承纠纷； （二）依法应当由行政机关处理的行政争议。"
      },
      {
        "number": 4,
        "sha256": "cf4920cfd94a3c494949afeb7d661bb88fef04f7088d0303aef61ddfc78ddca5",
        "text": "第四条 当事人选择仲裁方式解决纠纷，应当遵循自愿原则，达成仲裁协议。没有仲裁协议，一方申请仲裁的，仲裁机构不予受理。"
      },
      {
        "number": 5,
        "sha256": "15ffd654260f89493ec91d8d9cb2345687d6df5f587d899339bea7245de52380",
        "text": "第五条 当事人达成仲裁协议，一方向人民法院提起诉讼的，人民法院不予受理，但仲裁协议无效或者法律另有规定的除外。"
      },
      {
        "number": 6,
        "sha256": "9c88bb2ceed409f6328ec4d7d7652b052fdc9234de643b45c8201234b05afe3e",
        "text": "第六条 仲裁机构应当由当事人协议选定。 仲裁不实行级别管辖和地域管辖。"
      },
      {
        "number": 10,
        "sha256": "3ef69ffab93bd18d33de9f88a39552d7fe4589d3a3b9097d6f5374e2afb24f28",
        "text": "第十条 仲裁实行一裁终局的制度。裁决作出后，当事人就同一纠纷再申请仲裁或者向人民法院提起诉讼的，仲裁机构或者人民法院不予受理。 裁决被人民法院依法裁定撤销或者不予执行的，当事人就该纠纷可以根据双方重新达成的仲裁协议申请仲裁，也可以向人民法院提起诉讼。"
      },
      {
        "number": 11,
        "sha256": "635eb3cfbed513cbac91cd74f1f78c9e0273c1d038b7005d1ce3b0de229f1704",
        "text": "第十一条 仲裁活动可以通过信息网络在线进行，但当事人明确表示不同意的除外。 仲裁活动通过信息网络在线进行的，与线下仲裁活动具有同等法律效力。"
      },
      {
        "number": 27,
        "sha256": "e5fd176d3b5568b4d20fcfc6f6629dda8698477ba75fdc14011b0ac66b40f0cf",
        "text": "第二十七条 仲裁协议包括合同中订立的仲裁条款和以其他书面方式在纠纷发生前或者纠纷发生后达成的请求仲裁的协议。 仲裁协议应当具有下列内容： （一）请求仲裁的意思表示； （二）仲裁事项； （三）选定的仲裁机构。 一方当事人在申请仲裁时主张有仲裁协议，另一方当事人在首次开庭前不予否认的，经仲裁庭提示并记录，视为当事人之间存在仲裁协议。"
      },
      {
        "number": 28,
        "sha256": "5583365b61e13dec143ff980fda58d883de13600b95098358d914051c7a5b2d5",
        "text": "第二十八条 有下列情形之一的，仲裁协议无效： （一）约定的仲裁事项超出法律规定的仲裁范围； （二）无民事行为能力人或者限制民事行为能力人订立的仲裁协议； （三）一方采取胁迫手段，迫使对方订立仲裁协议。"
      },
      {
        "number": 29,
        "sha256": "b44393836c972bb03633095a2665efc5dcd33e18294257252fd6b6c9a31d3135",
        "text": "第二十九条 仲裁协议对仲裁事项或者仲裁机构没有约定或者约定不明确的，当事人可以补充协议；达不成补充协议的，仲裁协议无效。"
      },
      {
        "number": 30,
        "sha256": "1d9fafaddf2b988567ab144690e54a724019793c5ead7fe0bdb249dd282b33ce",
        "text": "第三十条 仲裁协议独立存在。合同是否成立及其变更、不生效、终止、被撤销或者无效，不影响已经达成的仲裁协议的效力。 仲裁庭有权确认合同的效力。"
      },
      {
        "number": 31,
        "sha256": "b077bba0ba533b3776805e64c22f08e7d3a6932746ea61f83364b78888b2a629",
        "text": "第三十一条 当事人对仲裁协议的效力有异议的，可以请求仲裁机构或者仲裁庭作出决定，也可以请求人民法院作出裁定。一方请求仲裁机构或者仲裁庭作出决定，另一方请求人民法院作出裁定的，由人民法院裁定。 当事人对仲裁协议的效力有异议，应当在仲裁庭首次开庭前提出。"
      },
      {
        "number": 32,
        "sha256": "c33a144571b01d07d9cbf9e89326dfd710a49fa6c16e167477e0730ace0ea849",
        "text": "第三十二条 当事人申请仲裁应当符合下列条件： （一）有仲裁协议； （二）有具体的仲裁请求和事实、理由； （三）属于仲裁机构的受理范围。"
      },
      {
        "number": 33,
        "sha256": "70c63577843cce9c4086843c676f2d06541af0ec8d896afad2d5b38f2253fb49",
        "text": "第三十三条 当事人申请仲裁，应当向仲裁机构递交仲裁协议、仲裁申请书及副本。"
      },
      {
        "number": 34,
        "sha256": "fc1754c0dfd2a29dc774b2ddf2c46dac3d01e8dd3e81e394f6853cb6a7afc560",
        "text": "第三十四条 仲裁申请书应当载明下列事项： （一）当事人的姓名、性别、年龄、职业、工作单位、住所、联系方式，法人或者非法人组织的名称、住所和法定代表人或者主要负责人的姓名、职务、联系方式； （二）仲裁请求和所根据的事实与理由； （三）证据和证据来源，证人姓名和住所。"
      },
      {
        "number": 35,
        "sha256": "d7eee366e81d91afc98918a4fd08483fa0a8ff70f3eb4f9f8f6bc1e227146eb9",
        "text": "第三十五条 仲裁机构收到仲裁申请书之日起五日内，认为符合受理条件的，应当受理，并通知申请人；认为不符合受理条件的，应当书面通知申请人不予受理，并说明理由。"
      },
      {
        "number": 37,
        "sha256": "93bc49eb941a2601d54fb68b06fb3244742f027a4db1ed03ee3623d81c7ffd74",
        "text": "第三十七条 当事人达成仲裁协议，一方向人民法院提起诉讼未声明有仲裁协议，人民法院受理后，另一方在首次开庭前提交仲裁协议的，人民法院应当驳回起诉，但仲裁协议无效或者法律另有规定的除外；另一方在首次开庭前未对人民法院受理该案提出异议的，视为放弃仲裁协议，人民法院应当继续审理。"
      },
      {
        "number": 38,
        "sha256": "06e5c246dbd1fa9954e817f0cee40989194a32646f26a6beb31059c81636bed5",
        "text": "第三十八条 申请人可以放弃或者变更仲裁请求。被申请人可以承认或者反驳仲裁请求，有权提出反请求。"
      },
      {
        "number": 39,
        "sha256": "a22f1384e6deba69670a8abdd6042d039fd4d229a16cc0805a3128f1f3754961",
        "text": "第三十九条 一方当事人因另一方当事人的行为或者其他原因，可能使裁决难以执行或者造成当事人其他损害的，可以申请财产保全、请求责令另一方当事人作出一定行为或者禁止其作出一定行为。当事人申请保全的，仲裁机构应当将当事人的申请依照《中华人民共和国民事诉讼法》的有关规定提交人民法院，人民法院应当依法及时处理。 因情况紧急，仲裁协议的当事人可以在申请仲裁前依照《中华人民共和国民事诉讼法》的有关规定向人民法院申请财产保全、请求责令另一方当事人作出一定行为或者禁止其作出一定行为。当事人申请保全的，人民法院应当依法及时处理。 申请有错误的，申请人应当赔偿被申请人因保全所遭受的损失。"
      },
      {
        "number": 40,
        "sha256": "248f3989a24574191da3d5747279485d5fc59b0eab1e42cc415ac97b8cd56271",
        "text": "第四十条 当事人、法定代理人可以委托律师和其他代理人进行仲裁活动。委托律师和其他代理人进行仲裁活动的，应当向仲裁机构提交授权委托书。"
      },
      {
        "number": 42,
        "sha256": "c9ce7bd6f45bc821d988090ef3219e1444363732aaa390cb44ce06de140c1834",
        "text": "第四十二条 仲裁庭可以由三名仲裁员或者一名仲裁员组成。由三名仲裁员组成的，设首席仲裁员。"
      },
      {
        "number": 43,
        "sha256": "415cc6674ab073e9a3c245b95a2f36a887999ea6f8187fe81ec2674064a70daf",
        "text": "第四十三条 当事人约定由三名仲裁员组成仲裁庭的，应当各自选定或者各自委托仲裁机构主任按照仲裁规则确定的程序指定一名仲裁员；第三名仲裁员由当事人共同选定，也可以由当事人共同委托仲裁机构主任按照仲裁规则确定的程序指定。当事人约定第三名仲裁员由其各自选定的仲裁员共同选定的，从其约定。第三名仲裁员是首席仲裁员。 当事人约定由一名仲裁员成立仲裁庭的，仲裁员由当事人共同选定，也可以由当事人共同委托仲裁机构主任按照仲裁规则确定的程序指定。"
      },
      {
        "number": 44,
        "sha256": "81f6a7d1796f4335e44e54050b172b4c813f90553eac7385c2ed2b4421485f24",
        "text": "第四十四条 当事人没有在仲裁规则规定的期限内约定仲裁庭的组成方式或者选定仲裁员的，由仲裁机构主任按照仲裁规则确定的程序确定或者指定。"
      },
      {
        "number": 45,
        "sha256": "86a2da7d2c51ef458b52f8ea34339903cd35d64bc02c2fbb06be8f61e1345262",
        "text": "第四十五条 仲裁员存在可能导致当事人对其独立性、公正性产生合理怀疑情形的，该仲裁员应当及时向仲裁机构书面披露。 仲裁机构应当将仲裁员书面披露情况、仲裁庭的组成情况书面通知当事人。"
      },
      {
        "number": 46,
        "sha256": "ac67a1adae19efc49b92e58189e8801c7280ab8988787c082eba3044ee72a398",
        "text": "第四十六条 仲裁员有下列情形之一的，必须回避，当事人也有权提出回避申请： （一）是本案当事人、代理人，或者当事人、代理人的近亲属； （二）与本案有利害关系； （三）与本案当事人、代理人有其他关系，可能影响公正仲裁； （四）私自会见当事人、代理人，或者接受当事人、代理人的请客送礼。"
      },
      {
        "number": 47,
        "sha256": "3b05750a57409942e721a9fd8f2a5542988788431a70d7e2df76e19de49bae6d",
        "text": "第四十七条 当事人提出回避申请，应当说明理由，在首次开庭前提出。回避事由在首次开庭后知道的，可以在最后一次开庭终结前提出。"
      },
      {
        "number": 48,
        "sha256": "4cf31e219214df8ba33ecf2956a24a8cd61a16796702ee69167d8d67e3fc562a",
        "text": "第四十八条 仲裁员是否回避，由仲裁机构主任决定；仲裁机构主任担任仲裁员时，其是否回避由仲裁机构的其他组成人员集体决定。"
      },
      {
        "number": 51,
        "sha256": "80eb9ccc706f386aca99a079c51d118b9dc4c31798d3a4b0db18948a5d59df41",
        "text": "第五十一条 仲裁应当开庭进行。当事人协议不开庭的，仲裁庭可以根据仲裁申请书、答辩书以及其他材料作出裁决。"
      },
      {
        "number": 52,
        "sha256": "3732e994014b377ee5a717a120ecadce4b2a98fbfce09fbc52b4011a81679ae9",
        "text": "第五十二条 仲裁不公开进行。当事人协议公开的，可以公开进行，但涉及国家秘密、他人的商业秘密或者个人隐私的除外。"
      },
      {
        "number": 54,
        "sha256": "ad442b8b416cf50bf9a91305a9abe3256171fc884f23bab70967575cf4433523",
        "text": "第五十四条 申请人经书面通知，无正当理由不到庭或者未经仲裁庭许可中途退庭的，可以视为撤回仲裁申请。 被申请人经书面通知，无正当理由不到庭或者未经仲裁庭许可中途退庭的，可以缺席裁决。"
      },
      {
        "number": 55,
        "sha256": "3adc4c25663706646d16802d4f0598aa7b749552cb6e54e1984ae721523ae41f",
        "text": "第五十五条 当事人应当对自己的主张提供证据。 仲裁庭认为有必要收集的证据，可以自行收集；必要时，可以请求有关方面依法予以协助。"
      },
      {
        "number": 57,
        "sha256": "076a9a9aef3fbaef51b4f69d017d55659a05c5fed29c06efb0494e0d8455edc6",
        "text": "第五十七条 证据应当在开庭时出示，当事人可以质证。"
      },
      {
        "number": 58,
        "sha256": "722e22f3d065a7657987750eb33d1d5fbdd61c0a0b173d823bf471bc352c572d",
        "text": "第五十八条 在证据可能灭失或者以后难以取得的情况下，当事人可以申请证据保全。当事人申请证据保全的，仲裁机构应当将当事人的申请提交证据所在地的基层人民法院，人民法院应当依法及时处理。 因情况紧急，仲裁协议的当事人可以在申请仲裁前依照《中华人民共和国民事诉讼法》的有关规定向人民法院申请证据保全。当事人申请证据保全的，人民法院应当依法及时处理。"
      },
      {
        "number": 59,
        "sha256": "c7affe698a5aafa2788d40065e0c7d4e70b95def4bcccd72abad88948e20b307",
        "text": "第五十九条 当事人在仲裁过程中有权进行辩论。辩论终结时，首席仲裁员或者独任仲裁员应当征询当事人的最后意见。"
      },
      {
        "number": 62,
        "sha256": "41c34fe7b5e5e4ba409c57348f9da068fe5e1995d0ca0a0ad96765291da2edb1",
        "text": "第六十二条 当事人申请仲裁后，可以自行和解。达成和解协议的，可以请求仲裁庭根据和解协议作出裁决书，也可以撤回仲裁申请。"
      },
      {
        "number": 64,
        "sha256": "7267395f3a9f90caecb9647f70ee3bbb0ecbfbc590a2121701c23f7e50bbf3db",
        "text": "第六十四条 仲裁庭在作出裁决前，可以先行调解。当事人自愿调解的，仲裁庭应当调解。调解不成的，应当及时作出裁决。 调解达成协议的，仲裁庭应当制作调解书或者根据协议的结果制作裁决书。调解书与裁决书具有同等法律效力。"
      },
      {
        "number": 65,
        "sha256": "894eda9eeebab93411634996a00b7cf32ae4f3d1778223f39e5f76d710a43f7f",
        "text": "第六十五条 调解书应当写明仲裁请求和当事人协议的结果。调解书由仲裁员签名，加盖仲裁机构印章，送达双方当事人。 调解书经双方当事人签收后，即发生法律效力。 在调解书签收前当事人反悔的，仲裁庭应当及时作出裁决。"
      },
      {
        "number": 66,
        "sha256": "c96d8b49d84d411b3cf98ac6ec4d07671db7b924b625f6d067e894b60581e0ae",
        "text": "第六十六条 裁决应当按照多数仲裁员的意见作出，少数仲裁员的不同意见可以记入笔录。仲裁庭不能形成多数意见时，裁决应当按照首席仲裁员的意见作出。"
      },
      {
        "number": 67,
        "sha256": "de6b1210a8b1c3c935faa5410d75ce76ed869fcac39ca800bce765189ce34cf0",
        "text": "第六十七条 裁决书应当写明仲裁请求、争议事实、裁决理由、裁决结果、仲裁费用的负担和裁决日期。当事人协议不愿写明争议事实和裁决理由的，可以不写。裁决书由仲裁员签名，加盖仲裁机构印章。对裁决持不同意见的仲裁员，可以签名，也可以不签名。"
      },
      {
        "number": 68,
        "sha256": "192d14a995559fc6a64f179fb34d64cb7611d83a618625e53e0b5d38a459b8bf",
        "text": "第六十八条 仲裁庭仲裁纠纷时，其中一部分事实已经清楚，可以就该部分先行裁决。"
      },
      {
        "number": 69,
        "sha256": "6b16ecb228eb1cbf24f8cf65ba2b5e51bb4326404d22c71e6c7d62a14a7b52db",
        "text": "第六十九条 对裁决书中的文字、计算错误或者仲裁庭已经裁决但在裁决书中遗漏的事项，仲裁庭应当补正；当事人自收到裁决书之日起三十日内，可以请求仲裁庭补正。"
      },
      {
        "number": 70,
        "sha256": "55df30a048a73d28807b23ad655df12e1db037b19807290dff6fb12b6b4bad52",
        "text": "第七十条 裁决书自作出之日起发生法律效力。"
      },
      {
        "number": 71,
        "sha256": "e93be567fb13b93a4b77467ce3cb0195822c4f3979d0db1dc4b467f1add5235e",
        "text": "第七十一条 当事人提出证据证明裁决有下列情形之一的，可以向仲裁机构所在地的中级人民法院申请撤销裁决： （一）没有仲裁协议； （二）裁决的事项不属于仲裁协议的范围或者仲裁机构无权仲裁； （三）仲裁庭的组成或者仲裁的程序违反法定程序； （四）裁决所根据的证据是伪造的； （五）对方当事人隐瞒了足以影响公正裁决的证据； （六）仲裁员在仲裁该案时有索贿受贿、徇私舞弊、枉法裁决行为。 人民法院经组成合议庭审查核实裁决有前款规定情形之一的，应当裁定撤销。 人民法院认定该裁决违背公共利益的，应当裁定撤销。"
      },
      {
        "number": 72,